<?xml version="1.0" encoding="UTF-8"?>
<Clientes xmlns:xsi="http://www.w3.org/2001/XMLSchema-instance"
xsi:noNamespaceSchemaLocation="Clientes_avanzado.xsd">
    <sede codigo ="G89">
        <direcciones>
            <direccion>El Prado NÂº39</direccion>
            <direccion> </direccion>
        </direcciones>
        <empleado id="1">
            <nombres>Pepito</nombres>
            <apellidos>Perez</apellidos>
            <puesto> secretario </puesto>
            <poblacion> Ubrique </poblacion>
            <edad> 39 </edad>
            <fecha_nacimiento> 1989-05-05 </fecha_nacimiento>
        </empleado>   
        <fecha_alta>2023-04-07</fecha_alta>
        <cliente codigo="1236">
            <nombre> Juana </nombre>
            <apellido> Magdalena </apellido>
            <trabajo> petaquero </trabajo>
            <historial> Es nueva  cleinte con buen historial financiero </historial>
            <descripcion_cliente>procedente</descripcion_cliente>
            <numero_viv>2</numero_viv> 
            <vivienda id="001">
                <antiguedad_anhos> 3 </antiguedad_anhos>
                <coste>1000.25</coste>
                <resumen>Se encuentra en buenas condiciones</resumen>
                <plazo>30</plazo>   
            </vivienda>
            <seguroSocial nss="12589653A"> 
                <nivel> alto </nivel>
                <categoria> nivel 4 </categoria>
            </seguroSocial>
            <aprobacion> true </aprobacion>
            
        </cliente>
    </sede>
</Clientes>